{
  "$schema": "https://memory-os.example/schemas/security/postgresql-rls-case-set.v1.schema.json",
  "caseSetId": "memory-os.security.postgresql-rls-cases.round9",
  "caseSetVersion": 2,
  "contractRef": "docs/fixtures/memory-os-security/postgresql-tenant-rls-contract.round9.valid.v1.json",
  "cases": [
    {"caseId":"same-owner-select","table":"import_job","command":"select","runtimeRole":"memory_api_runtime","sessionContextPresent":true,"sessionAccountId":"acct_01J00000000000000000000000","sessionEpoch":7,"rowOwnerAccountId":"acct_01J00000000000000000000000","rowEpoch":7,"expectedDecision":"allow","expectedIssueCode":"SEC_AUTHORIZED"},
    {"caseId":"cross-user-select","table":"import_job","command":"select","runtimeRole":"memory_api_runtime","sessionContextPresent":true,"sessionAccountId":"acct_01J99999999999999999999999","sessionEpoch":7,"rowOwnerAccountId":"acct_01J00000000000000000000000","rowEpoch":7,"expectedDecision":"deny","expectedIssueCode":"SEC_RLS_OWNER_MISMATCH"},
    {"caseId":"stale-epoch-select","table":"import_preview","command":"select","runtimeRole":"memory_api_runtime","sessionContextPresent":true,"sessionAccountId":"acct_01J00000000000000000000000","sessionEpoch":6,"rowOwnerAccountId":"acct_01J00000000000000000000000","rowEpoch":7,"expectedDecision":"deny","expectedIssueCode":"SEC_RLS_EPOCH_MISMATCH"},
    {"caseId":"missing-session-context","table":"quarantine_object","command":"select","runtimeRole":"memory_worker_runtime","sessionContextPresent":false,"sessionAccountId":"acct_01J00000000000000000000000","sessionEpoch":7,"rowOwnerAccountId":"acct_01J00000000000000000000000","rowEpoch":7,"expectedDecision":"deny","expectedIssueCode":"SEC_RLS_SESSION_CONTEXT_MISSING"},
    {"caseId":"same-owner-insert","table":"import_job","command":"insert","runtimeRole":"memory_api_runtime","sessionContextPresent":true,"sessionAccountId":"acct_01J00000000000000000000000","sessionEpoch":7,"rowOwnerAccountId":"acct_01J00000000000000000000000","rowEpoch":7,"proposedOwnerAccountId":"acct_01J00000000000000000000000","proposedEpoch":7,"expectedDecision":"allow","expectedIssueCode":"SEC_AUTHORIZED"},
    {"caseId":"foreign-owner-insert","table":"import_job","command":"insert","runtimeRole":"memory_api_runtime","sessionContextPresent":true,"sessionAccountId":"acct_01J00000000000000000000000","sessionEpoch":7,"rowOwnerAccountId":"acct_01J00000000000000000000000","rowEpoch":7,"proposedOwnerAccountId":"acct_01J99999999999999999999999","proposedEpoch":7,"expectedDecision":"deny","expectedIssueCode":"SEC_RLS_WITH_CHECK_FAILED"},
    {"caseId":"owner-mutation-update","table":"import_preview","command":"update","runtimeRole":"memory_api_runtime","sessionContextPresent":true,"sessionAccountId":"acct_01J00000000000000000000000","sessionEpoch":7,"rowOwnerAccountId":"acct_01J00000000000000000000000","rowEpoch":7,"proposedOwnerAccountId":"acct_01J99999999999999999999999","proposedEpoch":7,"expectedDecision":"deny","expectedIssueCode":"SEC_RLS_ROLE_NOT_ALLOWED"},
    {"caseId":"epoch-downgrade-update","table":"apply_confirmation","command":"update","runtimeRole":"memory_api_runtime","sessionContextPresent":true,"sessionAccountId":"acct_01J00000000000000000000000","sessionEpoch":7,"rowOwnerAccountId":"acct_01J00000000000000000000000","rowEpoch":7,"proposedOwnerAccountId":"acct_01J00000000000000000000000","proposedEpoch":6,"expectedDecision":"deny","expectedIssueCode":"SEC_RLS_ROLE_NOT_ALLOWED"},
    {"caseId":"worker-same-owner-select","table":"quarantine_object","command":"select","runtimeRole":"memory_worker_runtime","sessionContextPresent":true,"sessionAccountId":"acct_01J00000000000000000000000","sessionEpoch":7,"rowOwnerAccountId":"acct_01J00000000000000000000000","rowEpoch":7,"expectedDecision":"allow","expectedIssueCode":"SEC_AUTHORIZED"},
    {"caseId":"deletion-worker-same-owner-delete","table":"deletion_fence","command":"delete","runtimeRole":"memory_deletion_runtime","sessionContextPresent":true,"sessionAccountId":"acct_01J00000000000000000000000","sessionEpoch":8,"rowOwnerAccountId":"acct_01J00000000000000000000000","rowEpoch":8,"expectedDecision":"allow","expectedIssueCode":"SEC_AUTHORIZED"},
    {"caseId":"worker-delete-quarantine-denied","table":"quarantine_object","command":"delete","runtimeRole":"memory_worker_runtime","sessionContextPresent":true,"sessionAccountId":"acct_01J00000000000000000000000","sessionEpoch":7,"rowOwnerAccountId":"acct_01J00000000000000000000000","rowEpoch":7,"expectedDecision":"deny","expectedIssueCode":"SEC_RLS_ROLE_NOT_ALLOWED"},
    {"caseId":"api-delete-quarantine-denied","table":"quarantine_object","command":"delete","runtimeRole":"memory_api_runtime","sessionContextPresent":true,"sessionAccountId":"acct_01J00000000000000000000000","sessionEpoch":7,"rowOwnerAccountId":"acct_01J00000000000000000000000","rowEpoch":7,"expectedDecision":"deny","expectedIssueCode":"SEC_RLS_ROLE_NOT_ALLOWED"},
    {"caseId":"api-update-immutable-preview-denied","table":"import_preview","command":"update","runtimeRole":"memory_api_runtime","sessionContextPresent":true,"sessionAccountId":"acct_01J00000000000000000000000","sessionEpoch":7,"rowOwnerAccountId":"acct_01J00000000000000000000000","rowEpoch":7,"proposedOwnerAccountId":"acct_01J00000000000000000000000","proposedEpoch":7,"expectedDecision":"deny","expectedIssueCode":"SEC_RLS_ROLE_NOT_ALLOWED"},
    {"caseId":"worker-insert-apply-confirmation-denied","table":"apply_confirmation","command":"insert","runtimeRole":"memory_worker_runtime","sessionContextPresent":true,"sessionAccountId":"acct_01J00000000000000000000000","sessionEpoch":7,"rowOwnerAccountId":"acct_01J00000000000000000000000","rowEpoch":7,"proposedOwnerAccountId":"acct_01J00000000000000000000000","proposedEpoch":7,"expectedDecision":"deny","expectedIssueCode":"SEC_RLS_ROLE_NOT_ALLOWED"}
  ]
}
